[
  {
    "targetId": "aramco",
    "checkedAtISO": "2026-08-29T01:25:42.587Z",
    "urlTried": "https://www.aramco.com/en/careers/for-saudi-applicants/student-opportunities",
    "outcome": "verified",
    "note": "عنوان الصفحة: \"Student programs | Aramco\". قرأت عليها حرفياً: \"Scholarship opportunities and job preparation programs for students.\" وتسرد برامج الطلبة: College continuation program، Apprenticeship program، College degree program، Vocational Colleges Graduates، Summer Training. صفحة برامج طلبة رسمية، وصفحة التدريب الجامعي فرعية منها."
  },
  {
    "targetId": "sdaia",
    "checkedAtISO": "2026-08-29T01:25:42.587Z",
    "urlTried": "https://sdaia.gov.sa/ar/Sectors/BuildingCapacity/Pages/CooperativeTraining.aspx",
    "outcome": "verified",
    "note": "عنوان الصفحة: \"سدايا | برنامج سدايا للتدريب التعاوني\". قرأت عليها حرفياً: \"يهدف برنامج سدايا للتدريب التعاوني إلى تقديم تدريب عملي وعلى رأس العمل لطلاب وطالبات الجامعات في المملكة.\" وعليها رابط \"التسجيل في التدريب التعاوني\". صفحة تدريب تعاوني صريحة."
  },
  {
    "targetId": "nca",
    "checkedAtISO": "2026-08-29T01:25:42.587Z",
    "urlTried": "https://nca.gov.sa/ar/cyber-training-and-qualifications/",
    "outcome": "verified",
    "note": "عنوان الصفحة: \"تأهيل وتدريب الكوادر السيبرانية | NCA\". قرأت عليها حرفياً: \"تأهيل وتدريب الكوادر السيبرانية\" و\"أبرز البرامج\" و\"تاريخ آخر تعديل: 02/06/2025\". صفحة تدريب رسمية للهيئة، لكنها ليست صفحة تدريب تعاوني محدّدة، ولم يظهر عليها إعلان تعاوني وقت الفحص."
  },
  {
    "targetId": "sabic",
    "checkedAtISO": "2026-08-29T01:25:42.587Z",
    "urlTried": "https://www.sabic.com/ar/careers/middle-east-africa/students-and-fresh-graduates",
    "outcome": "verified",
    "note": "عنوان الصفحة: \"SABIC - الطلاب والخريجون\". قرأت عليها حرفياً: \"تقدّم (سابك) مجموعة واسعة من فرص التطوير والمسارات المهنية للطلاب والخريجين الجدد\" و\"من خلال برامج متخصصة مثل برامج المسار المهني المبكر، والتدريب التعاوني، وبرامج الابتعاث\". ذكر صريح للتدريب التعاوني."
  },
  {
    "targetId": "stc",
    "checkedAtISO": "2026-08-29T01:25:42.587Z",
    "urlTried": "https://careers.stc.com.sa/",
    "outcome": "rejected",
    "note": "عنوان الصفحة: \"Jobs at stc\". قرأت عليها حرفياً: \"find a job create an account easy apply about us join us\" و\"your journey begins here\". بوابة وظائف رسمية مؤكّدة، لكن لا قسم تدريب فيها ولا ذكر للتدريب التعاوني."
  },
  {
    "targetId": "sama",
    "checkedAtISO": "2026-08-29T01:25:42.587Z",
    "urlTried": "https://careers.sama.gov.sa/",
    "outcome": "rejected",
    "note": "عنوان الصفحة: \"SAMA Careers\". قرأت عليها حرفياً: \"Saudi Central Bank welcomes you in our Recruitment Page\" و\"Join the Saudi Central Bank Talent Community\". بوابة توظيف رسمية مؤكّدة، بلا قسم تدريب ظاهر."
  },
  {
    "targetId": "sama",
    "checkedAtISO": "2026-08-29T01:25:42.587Z",
    "urlTried": "https://careers.sama.gov.sa/ar/page/coop-program/",
    "outcome": "rejected",
    "note": "المرشّح أعاد التوجيه إلى https://careers.sama.gov.sa/errorpage/?errortype=404 بعنوان \"SAMA Careers\"، ولم يعرض أي محتوى تدريب. الصفحة غير موجودة."
  },
  {
    "targetId": "pif",
    "checkedAtISO": "2026-08-29T01:25:42.587Z",
    "urlTried": "https://www.pif.gov.sa/en/careers/",
    "outcome": "rejected",
    "note": "عنوان الصفحة: \"Careers\". المحتوى الظاهر إشعار ملفات ارتباط وقائمة تنقّل فقط، بلا قسم تدريب يمكن قراءته. والبحث لم يُظهر إلا Graduate Development Program، وهو تطوير الخريجين والمستخدم غير مؤهّل له قبل التخرّج."
  },
  {
    "targetId": "site",
    "checkedAtISO": "2026-08-29T01:25:42.587Z",
    "urlTried": null,
    "outcome": "not_found",
    "note": "بحثان اثنان لم يُظهرا أي نطاق رسمي للشركة. كل النتائج مواقع وظائف طرف ثالث: wadhefa و jobzaty و ewdifh و sabbar. لم أخمّن نطاقاً. الرابط الرسمي يحتاج إدخالاً يدوياً."
  },
  {
    "targetId": "taif_field_training",
    "checkedAtISO": "2026-08-29T01:25:42.587Z",
    "urlTried": "https://webapps.tu.edu.sa/TuITTrainSys/",
    "outcome": "unreachable",
    "note": "ظهر في نتائج البحث بعنوان \"جامعة الطائف - نظام التدريب الميداني\". رفض المتصفح الاتصال بالنطاق webapps.tu.edu.sa في محاولتين متتاليتين، فلم تُقرأ الصفحة ولم يُثبَّت الرابط."
  },
  {
    "targetId": "elm",
    "checkedAtISO": "2026-08-29T01:46:07.173Z",
    "urlTried": "https://career.elm.sa/elm/go/coop-trainee-and-training-program/8486100/",
    "outcome": "verified",
    "note": "وسم title فارغ على هذه الصفحة، وعنوان التبويب هو المسار نفسه. قرأت عليها حرفياً: \"coop trainee and training program\" و\"المتدربون وبرامج التدريب\" و\"سد الفجوة بين الخبرة التعليمية والعملية\". صفحة فئة التدريب التعاوني في بوابة توظيف علم، ولا شواغر معروضة وقت الفحص."
  },
  {
    "targetId": "tetco",
    "checkedAtISO": "2026-08-29T01:46:07.173Z",
    "urlTried": "https://tetco.sa/ar/careers",
    "outcome": "verified",
    "note": "عنوان الصفحة: \"وظائف | Tetco\". قرأت عليها حرفياً: \"التدريب التعاوني هو برنامج تدريبي يوفر تجربة قيمة وفريدة للطلاب المتوقع تخرجهم، ويسعون إلى استكمال متطلبات تخرجهم الأكاديمية خلال فترة التدريب\"، وعنوان القسم \"التوظيف والتدريب التعاوني\"."
  },
  {
    "targetId": "mcit",
    "checkedAtISO": "2026-08-29T01:46:07.173Z",
    "urlTried": "https://futureskills.mcit.gov.sa/ar/coop-training",
    "outcome": "verified",
    "note": "عنوان الصفحة: \"التدريب التعاوني | بوابة مهارات المستقبل\". قرأت عليها حرفياً: \"التدريب التعاوني\" ثم \"لا توجد نتائج بحث توافق البيانات المدخلة\". صفحة التدريب التعاوني في بوابة مهارات المستقبل التابعة للوزارة، وقائمتها فارغة وقت الفحص."
  },
  {
    "targetId": "mobily",
    "checkedAtISO": "2026-08-29T01:46:07.173Z",
    "urlTried": "https://careers.mobily.com.sa/ar/sites/opportunities/pages/Coop",
    "outcome": "verified",
    "note": "عنوان الصفحة: \"Coop Program - موبايلي المسارات الوظيفية\". قرأت عليها حرفياً: \"صممنا برنامج التدريب التعاوني بدقة لسد الفجوة بين المعرفة النظرية المكتسبة في السنوات الماضية وبين الخبرة العملية\" و\"طلاب التكنولوجيا: سواء كنت تدرس تخصصًا في التكنولوجيا، فإن معدل تقديرك الذي يبلغ 3.25/5 أو 2.60/4 أو أعلى يفتح الأبواب أمامك\"."
  },
  {
    "targetId": "stc",
    "checkedAtISO": "2026-08-29T01:46:07.173Z",
    "urlTried": "https://careers.stc.com.sa/go/%D8%A7%D9%84%D8%AA%D8%AF%D8%B1%D9%8A%D8%A8-%D8%A7%D9%84%D8%AA%D8%B9%D8%A7%D9%88%D9%86%D9%8A/7736823/",
    "outcome": "verified",
    "note": "وسم title فارغ على هذه الصفحة. قرأت عليها حرفياً: \"التدريب التعاوني\" كعنوان الفئة، ثم \"لا توجد حاليًا أي مناصب شاغرة مطابقة لهذه الفئة أو هذا الموقع\". صفحة فئة التدريب التعاوني داخل بوابة توظيف stc، وهي غير الصفحة الرئيسية التي رُفضت سابقاً."
  },
  {
    "targetId": "takamol",
    "checkedAtISO": "2026-08-29T01:46:07.173Z",
    "urlTried": "https://takamolholding.com/ar/join-us",
    "outcome": "rejected",
    "note": "عنوان الصفحة: \"التوظيف في تكامل القابضة | انضم إلى فريقنا المبتكر\". قرأت عليها حرفياً: \"الفرص التدريبية انضم إلى برنامج «تكاملي طموح»، المصمم لتطوير وتدريب الكفاءات الواعدة من حديثي التخرج\"، وحالته \"مغلق\". البرنامج الوحيد المعروض لحديثي التخرج لا لطلاب التدريب التعاوني، والمستخدم غير مؤهّل له قبل التخرّج. لا ترد أي من علامات القبول على الصفحة."
  },
  {
    "targetId": "thiqah",
    "checkedAtISO": "2026-08-29T01:46:07.173Z",
    "urlTried": "https://www.thiqah.sa/",
    "outcome": "rejected",
    "note": "عنوان الصفحة: \"Home\". قرأت عليها حرفياً: \"نصنع الأثر عبر التحول الرقمي\" وأقساماً للأخبار والحلول. صفحة شركة عامة بلا قسم توظيف أو تدريب ظاهر. قناة التقديم تبقى البريد coop@thiqah.sa."
  },
  {
    "targetId": "ncac",
    "checkedAtISO": "2026-08-29T01:46:07.173Z",
    "urlTried": "https://nca.gov.sa/ar/education-program/",
    "outcome": "rejected",
    "note": "عنوان الصفحة: \"البرامج التعليمية | NCA\". قرأت عليها حرفياً: \"البرامج التعليمية\" و\"التعليم العالي\" و\"تستهدف الهيئة تحقيق متطلبات سوق العمل الحالي والمستقبلي؛ من خلال رفع مستوى جودة البرامج الأكاديمية\". صفحة سياسة تعليمية لا صفحة تدريب، ولا ترد فيها أي من علامات القبول. ونطاق الأكاديمية ncac.edu.sa رفض الاتصال في محاولة سابقة."
  },
  {
    "targetId": "taqnia",
    "checkedAtISO": "2026-08-29T01:46:07.173Z",
    "urlTried": "https://taqnia.com/en/",
    "outcome": "rejected",
    "note": "عنوان الصفحة: \"404 Not Found\". قرأت عليها حرفياً: \"The requested URL was not found on this server\" و\"Apache Server at taqnia.com Port 443\". الرابط المستورد من ملف COOP ميت."
  },
  {
    "targetId": "citc",
    "checkedAtISO": "2026-08-29T01:46:07.173Z",
    "urlTried": "https://www.cst.gov.sa/",
    "outcome": "rejected",
    "note": "الرابط citc.gov.sa يعيد التوجيه إلى https://www.cst.gov.sa/ بعنوان \"هيئة الاتصالات والفضاء والتقنية | المملكة العربية السعودية\"، وهذا يؤكّد تغيّر الاسم فعلياً. الصفحة رئيسية تنظيمية، قرأت عليها \"ننظم قطاع الاتصالات لربط المملكة بكفاءة وموثوقية\" و\"الخدمات الرقمية\"، بلا قسم توظيف أو تدريب."
  },
  {
    "targetId": "simah",
    "checkedAtISO": "2026-08-29T01:46:07.173Z",
    "urlTried": "https://www.simah.com/en/personal/pages/default.aspx",
    "outcome": "unreachable",
    "note": "حجب Cloudflare. عنوان الصفحة: \"Attention Required! | Cloudflare\"، ونصها \"Sorry, you have been blocked. You are unable to access simah.com\". لم تُقرأ الصفحة."
  },
  {
    "targetId": "ncdc",
    "checkedAtISO": "2026-08-29T01:46:07.173Z",
    "urlTried": "https://www.ncdc.gov.sa/",
    "outcome": "unreachable",
    "note": "رفض المتصفح الاتصال بنطاق ncdc.gov.sa. لم تُقرأ الصفحة. مهام المركز نُقلت إلى وزارة الاتصالات، وقد يكون النطاق متوقفاً."
  },
  {
    "targetId": "site",
    "checkedAtISO": "2026-08-29T01:46:07.173Z",
    "urlTried": null,
    "outcome": "not_found",
    "note": "محاولة ثانية ببحث موجّه بعبارة \"التدريب التعاوني\" مع اسم الشركة. النتائج كلها مواقع وظائف طرف ثالث (wadhefa و jobzaty و wzufa) وتؤكّد وجود برنامج تدريب تعاوني في الشركة فعلاً، لكن لا يظهر أي نطاق رسمي لها. لم أخمّن نطاقاً."
  },
  {
    "targetId": "cma",
    "checkedAtISO": "2026-08-29T01:52:59.324Z",
    "urlTried": "https://careers.cma.gov.sa/ar/page/coop-program/",
    "outcome": "verified",